CDSCO Drug Name,FDA Drug Name,Similarity Score,Match Type,CDSCO Approval Date,FDA Approval Date,CDSCO Indication,FDA Indication,Token Score,Ratio Score
"Tenofovir, Emtricitabine, Efavirenz",Tenofovir,0.8545454545454545,Fuzzy,01/08/2006,24/03/2010,Treatment of HIV-1 infection in adults,Treatment of HIV infection in combination with other antiretroviral agents in patients 12 to less than 18 years of age,100.0,42.85714285714286
"Artesunate, Pyrimethamine, Sulphadoxine",Artesunate,0.854054054054054,Fuzzy,28/05/2010,26/05/2020,Additional strength,Artesunate for Injection is indicated for the initial treatment of severe malaria in adult and pediatric patients. Treatment of severe malaria with Artesunate for Injection should always be followed by a complete treatment course of an appropriate oral antimalarial regimen.,100.0,42.553191489361694
"Artesunate, Sulphadoxine, Pyrimethamine",Artesunate,0.854054054054054,Fuzzy,05/04/2010,26/05/2020,,Artesunate for Injection is indicated for the initial treatment of severe malaria in adult and pediatric patients. Treatment of severe malaria with Artesunate for Injection should always be followed by a complete treatment course of an appropriate oral antimalarial regimen.,100.0,42.553191489361694
Memantine Hydrochloride,Amantadine Hydrochloride,0.7864906832298137,Fuzzy,06/09/2010,24/08/2017,Treatment of moderate to severe Alzheimer's disease,treatment of dyskinesia in patients with Parkinson's disease receiving levodopa-based therapy with or without concomitant dopminergic medications,89.36170212765957,89.36170212765957
Articaine Hydrochloride,Amantadine Hydrochloride,0.7758695652173913,Fuzzy,01/08/1986,24/08/2017,"Local anesthesia for spinal infiltration, dental surgery, and epidural use",treatment of dyskinesia in patients with Parkinson's disease receiving levodopa-based therapy with or without concomitant dopminergic medications,85.1063829787234,85.1063829787234
