CDSCO Drug Name,FDA Drug Name,Similarity Score,Match Type,CDSCO Approval Date,FDA Approval Date,CDSCO Indication,FDA Indication,Token Score,Ratio Score
Tacrolimus,Tacrolimus,1.0,RxNorm,24/04/2010,29/03/2006,,Prophylaxis of organ rejection in patients receiving allogenic heart transplants.,,
Aztreonam,Aztreonam,1.0,RxNorm,01/11/2002,22/02/2010,"Treatment of urinary tract infection, lower respiratory tract infection, septicemia, skin and skin structure infections, intra-abdominal infections, gynecological infections",To improve respiratory symptoms in cystic fibrosis (CF) patients with Pseudomonas aeruginosa,,
Lenalidomide,Lenalidomide,1.0,RxNorm,22/04/2008,29/06/2006,In combination with dexamethasone for treatment of multiple myeloma in previously treated patients,For use in combination with dexamethasone for the treatment of multiple myeloma patients who have received at least one prior therapy,,
Clonidine,Clonidine,1.0,RxNorm,01/07/1975,02/10/1996,Treatment of hypertension,In combination with opiates for the treatment of severe pain in cancer patients that is not adequately relieved by opioid analgesics alone.,,
Decitabine,Decitabine,1.0,RxNorm,28/04/2009,02/05/2006,"Treatment of myelodysplastic syndromes (MDS), including all subtypes","for treatment of patients with myelodysplastic syndromes (MDS) including previously treated and untreated, de novo and secondary MDS of all French-American-British subtypes (refractory anemia, refractory anemia with ringed sideroblasts, refractory anemia with excess blasts, refractory anemia with excess blasts in transformation, and chronic myelomonocytic leukemia) and intermediate-1, intermediate-2, and high-risk International Prognostic Scoring System groups",,
Midazolam,Midazolam,1.0,RxNorm,15/04/1997,17/05/2019,"General anaesthesia, preoperative sedation, conscious sedation prior to diagnostic or endoscopic procedure","NAYZILAM is indicated for the acute treatment of intermittent, stereotypic episodes of frequent seizure activity (i.e., seizure clusters, acute repetitive seizures) that are distinct from a patients usual seizure pattern in patients with epilepsy 12 years of age and older.",,
Deferasirox,Deferasirox,1.0,RxNorm,17/08/2007,18/05/2017,As approved,Treatment of chronic iron overload in patients 10 years of age and older with non-transfusion-dependent thalassemia (NTDT) syndromes and with a liver iron concentration (LIC) of at least 5 milligrams of iron per gram of liver dry weight (mg Fe/g dw) and a serum ferritin greater than 300 mcg/L.,,
Sorafenib,Sorafenib,1.0,RxNorm,01/08/2007,16/11/2007,Treatment of advanced renal cell carcinoma,Treatment of unresectable hepatocellular carcinoma,,
Gefitinib,Gefitinib,1.0,RxNorm,17/02/2004,13/07/2015,Anticancer,For the first-line treatment of patients with metastatic non-small cell lung cancer (NSCLC) whose tumors have epidermal growth factor receptor (EGFR) exon 19 deletions or exon 21 (L858R) substitution mutations as detected by an FDA-approved test,,
Paclitaxel,Paclitaxel,1.0,RxNorm,23/08/2006,04/08/1997,Treatment of metastatic breast cancer,For the second line treatment of AIDS-related Kaposi's sarcoma.,,
Sirolimus,Sirolimus,1.0,RxNorm,31/12/2002,28/05/2015,Prophylaxis of organ rejection in patients receiving renal transplant with cyclosporins and corticosteroids,Treatment of lymphangioleiomyomatosis (LAM),,
Bortezomib,Bortezomib,1.0,RxNorm,05/09/2007,08/12/2006,Treatment of mantle cell lymphoma in patients with at least one prior therapy,Treatment of patients with mantle cell lymphoma who have received at least 1 prior therapy.,,
Dasatinib,Dasatinib,1.0,RxNorm,30/08/2006,09/11/2017,"Treatment of adults with chronic, accelerated, or myeloid/lymphoid blast phase chronic myeloid leukemia (CML)",Treatment of pediatric patients with Philadelphia chromosome-positive (Ph+) chronic myeloid leukemia (CML) in chronic phase,,
Miltefosine,Miltefosine,1.0,RxNorm,15/03/2002,19/03/2014,Treatment of visceral leishmaniasis,"Treatment of visceral leishmaniasis due to Leishmania donovani; cutaneous leishmaniasis due to Leishmania braziliensis, Leishmania guyanensis, and Leishmania panamensis; and mucosal leishmaniasis due to Leishmania braziliensis.",,
Pentosan Polysulfate Sodium,Pentosan Polysulfate Sodium,1.0,RxNorm,11/05/2010,26/09/1996,Relief of bladder pain or discomfort associated with interstitial cystitis,Relief of bladder pain or discomfort associated with interstitial cystitis.,,
Albendazole,Albendazole,1.0,RxNorm,28/11/2011,11/06/1996,"Treatment of systemic helminth infections: neurocysticercosis, echinococcosis","Treatment of parenchymal neurocysticercosis due to active lesions caused by larval forms of the pork tapeworm, Taenia solium.",,
Disodium Cromoglycate,Cromolyn Sodium,1.0,RxNorm,01/09/1976,22/12/1989,,,,
Ibrutinib,Ibrutinib,1.0,RxNorm,07/10/2015,02/08/2017,"Treatment of adult patients with mantle cell lymphoma (MCL), CLL after prior therapy, or CLL with 17p deletion",Treatment of adult patients with chronic graft versus host disease (cGVHD) after failure of one or more lines of systemic therapy.,,
Posaconazole,Posaconazole,1.0,RxNorm,20/12/2011,17/06/2021,Treatment of zygomycosis refractory or intolerant to other therapy,Treatment of invasive aspergillosis in adults and pediatric patients 13 years of age and older,,
Rifabutin,Rifabutin,1.0,RxNorm,19/07/2007,23/12/1992,Treatment of pulmonary tuberculosis in HIV co-infected patients,Prevention of disseminated Mycobacterium avium complex disease in patients with advanced HIV infections.,,
Tretinoin,Tretinoin,1.0,RxNorm,01/07/1974,22/11/1995,Treatment of acne vulgaris,Induction of remission in patients with acute promyelocytic leukemia who are refractory to or unable to tolerate anthracycline based cytotoxic chemotherapeutic regimens.,,
Bendamustine Hydrochloride,Bendamustine Hydrochloride,1.0,RxNorm,19/05/2009,31/10/2008,Treatment of chronic lymphocytic leukemia,Treatment of Indolent B-cell non-Hodgkin lymphoma (NHL) that has progressed during or within six months of treatment with rituximab or a rituximab-containing regimen.,,
Etanercept,Etanercept,1.0,RxNorm,07/12/2001,27/05/1999,Reduction of moderate to severe active rheumatoid arthritis after inadequate response to DMARDs,Reducing signs and symptoms of moderately to severely active polyarticular juvenile idiopathic arthritis (JIA) in patients ages 2 and older,,
Nintedanib,Nintedanib,1.0,RxNorm,11/03/2016,06/09/2019,Treatment of idiopathic pulmonary fibrosis,OFEV is indicated to slow the rate of decline in pulmonary function in patients with systemic sclerosis associated interstitial lung disease (SSc-ILD).,,
Ruxolitinib,Ruxolitinib,1.0,RxNorm,28/01/2013,22/09/2021,Treatment of myelofibrosis,Treatment of chronic graft-versus-host disease (cGVHD) after failure of one or two lines of systemic therapy in adult and pediatric patients 12 years and older,,
Sofosbuvir,Sofosbuvir,1.0,RxNorm,13/01/2015,07/04/2017,Treatment of chronic hepatitis C (with other medications),Treatment of chronic HCV genotype 2 or 3 infection in pediatric patients 12 years of age and older or weighing at least 35 kg without cirrhosis or with compensated cirrhosis for use in combination with ribavirin,,
Aripiprazole,Aripiprazole,1.0,RxNorm,23/02/2004,12/12/2014,Treatment of schizophrenia,Treatment of pediatric patients with Tourette's,,
Mitoxantrone,Mitoxantrone,1.0,RxNorm,01/03/1989,13/10/2000,,"Reducing neurologic disability and/or the frequency of clinical relapses in patients with secondary (chronic) progressive, progressive relapsing, or worsening relapsing-remitting multiple sclerosis (i.e., patients whose neurologic status is significantly adnormal between relapses).",,
Tinidazole,Tinidazole,1.0,RxNorm,01/12/1983,17/05/2004,,Treatment of giardiasis caused by G. duodenalis (also termed G. lamblia) in both adults and pediatric patients older than three years of age,,
Imatinib Mesylate,Imatinib Mesylate,1.0,RxNorm,11/08/2011,19/12/2008,"Treatment of Ph+ALL (newly diagnosed, relapsed/refractory), CML, GIST, other approved indications",Adjuvant treatment of adult patients following complete resection Kit (CD 117) positive gastrointestinal stromal tumors (GIST).,,
Rifaximin,Rifaximin,1.0,RxNorm,18/08/2011,24/03/2010,Reduction in risk of overt hepatic encephalopathy recurrence in adults (≥18 years),Reduction in the risk of overt hepatic encephalopathy (HE) recurrence in patients greater than or equal to 18 years of age,,
Dexamethasone,Dexamethasone,1.0,RxNorm,02/11/2004,03/10/2019,"Steroid-responsive neoplastic disease (leukemias, lymphomas) in adults (by oncologists only)",HEMADY is indicated in combination with other anti-myeloma products for the treatment of adults with multiple myeloma,,
Abatacept,Abatacept,1.0,RxNorm,10/04/2009,15/12/2021,Reducing signs and symptoms of moderate to severe active polyarticular juvenile idiopathic arthritis,"prophylaxis of acute graft versus host disease (aGVHD), in combination with a calcineurin inhibitor and methotrexate, in adults and pediatric patients 2 years of age and older undergoing hematopoietic stem cell transplantation (HSCT) from a matched or 1 allele-mismatched unrelated-donor",,
Trabectedin,Trabectedin,1.0,RxNorm,01/04/2009,23/10/2015,"Treatment of advanced soft tissue sarcoma after failure of anthracyclines and ifosfamide, or when unsuited to receive these agents",For the treatment of patients with unresectable or metastatic liposarcoma or leiomyosarcoma who received a prior anthracycline-containing regimen,,
Lamotrigine,Lamotrigine,1.0,RxNorm,05/04/2010,24/08/1998,Same as approved (refer to main lamotrigine indication),Adjunctive treatment of Lennox-Gastaut syndrome in pediatric and adult patients.,,
Methotrexate,Methotrexate,1.0,RxNorm,25/11/2005,25/04/2017,Psoriasis,"Management of pediatric patients with active polyarticular juvenile idiopathic arthritis (pJIA) who have had an insufficient therapeutic response to, or are intolerant of, an adequate trial of first-line therapy including full dose non-steroidal anti-inflammatory agents (NSAIDs).",,
Ursodeoxycholic Acid,Ursodiol,1.0,RxNorm,01/12/2004,10/12/1997,"Dissolution of radiolucent cholesterol gallstones; treatment of chronic cholestatic liver diseases, primary biliary cirrhosis, sclerosing cholangitis, cystic fibrosis-associated cholestasis",,,
Mitomycin-C,Mitomycin-C,1.0,RxNorm,01/12/1972,07/02/2012,—,An adjunct to ab externo glaucoma surgery.,,
Leuprolide Acetate,Leuprolide Acetate,1.0,RxNorm,03/12/2003,16/04/1993,Treatment of advanced prostatic cancer,Treatment of children with central precocious puberty,,
Topiramate,Topiramate,1.0,RxNorm,24/12/2001,28/08/2001,,As adjunctive therapy in patients two years and older with siezures associated with Lennox-Gastaut syndrome.,,
Afatinib,Afatinib,1.0,RxNorm,30/12/2014,15/04/2016,Treatment of locally advanced or metastatic non-small cell lung cancer (NSCLC) with EGFR mutation,"Treatment of patients with metastatic, squamous, non-small cell lung cancer progressing after platinum-based chemotherapy",,
Etidronate Disodium,Etidronate Disodium,1.0,RxNorm,10/03/1995,21/04/1987,Treatment of hypercalcemia induced by malignant disorders,,,
Ofloxacin,Ofloxacin,1.0,RxNorm,01/05/1991,22/05/1996,"Treatment of respiratory, urinary tract, gynecological, skin and soft tissue infections",Treatment of bacterial corneal ulcers.,,
Ambrisentan,Ambrisentan,1.0,RxNorm,28/05/2010,15/06/2007,Treatment of pulmonary arterial hypertension (WHO Group I) in patients with class II or III symptoms to improve exercise capacity and delay clinical worsening,Treatment of pulmonary arterial hypertension (WHO group I) in patients with WHO class II or III symptoms to improve exercise capacity and delay clinical worsening,,
Valacyclovir,Acyclovir,1.0,Fuzzy,25/09/2002,29/03/2019,Treatment of herpes zoster and genital herpes (initial and recurrent),AVACLYR is a sterile topical antiviral indicated for the treatment of acute herpetic keratitis (dendritic ulcers) in patients with herpes simplex (HSV-1 and HSV-2) virus.,100.0,100.0
Clofazimine,Clofazimine,1.0,RxNorm,01/09/1969,15/12/1986,Anti-leprosy drug,,,
Temozolomide,Temozolomide,1.0,RxNorm,17/01/2000,15/03/2005,"Treatment of recurrent malignant glioma (glioblastoma multiforme, anaplastic astrocytoma) in adults",Treatment of adult patients with newly diagnosed glioblastoma multiforme concomitatly with radiotherapy and then as maintenance treatment,,
Eribulin Mesylate,Eribulin Mesylate,1.0,RxNorm,18/02/2015,28/01/2016,Treatment of locally advanced or metastatic breast cancer after at least one prior chemotherapy regimen,Treatment of patients with unresectable or metastatic liposarcoma who have received a prior anthracyclne-containing regimen,,
Aprotinin,Aprotinin,1.0,RxNorm,27/05/1905,29/12/1993,,,,
Baclofen,Baclofen,1.0,RxNorm,22/02/2007,25/06/1992,As approved,Management of severe spasticity of spinal cord origin in patients who are unresponsive to oral baclofen therapy or experience intolerable CNS side effects at effective doses.,,
Triclabendazole,Triclabendazole,1.0,RxNorm,01/09/1988,13/02/2019,"Broad spectrum flukicide for treatment of chronic fascioliasis (F. gigantica, F. hepatica) in livestock",EGATEN is indicated for the treatment of fascioliasis in patients 6 years of age and older.,,
Bedaquiline,Bedaquiline,1.0,RxNorm,14/01/2015,27/05/2020,Part of combination therapy for pulmonary multidrug-resistant tuberculosis in adults when effective regimen cannot otherwise be provided,SIRTURO is a diarylquinoline antimycobacterial drug indicated as part of combination therapy in adult and pediatric patients (5 years and older and weighing at least 15 kg) with pulmonary multi-drug resistant tuberculosis (MDR-TB). Reserve SIRTURO for use when an effective treatment regimen cannot otherwise be provided.,,
Lenvatinib,Lenvatinib,1.0,RxNorm,02/12/2016,15/08/2018,Treatment of locally recurrent/metastatic progressive radioactive iodine refractory differentiated thyroid cancer,LENVIMA is indicated for the first-line treatment of patients with unresectable hepatocellular carcinoma (HCC),,
Pazopanib,Pazopanib,1.0,RxNorm,23/02/2015,26/04/2012,Treatment of advanced soft tissue sarcoma (STS) in patients who have received prior chemotherapy,Advanced soft tissue sarcoma (STS) who have received prior chemotherapy,,
Cinacalcet,Cinacalcet,1.0,RxNorm,16/01/2009,21/11/2014,Treatment of secondary hyperparathyroidism in CKD on dialysis and hypercalcemia in parathyroid carcinoma,"Treatment of hypercalcemia in adult patients with primary hyperparathyroidism for whom parathyroidectomy would be indicated on the basis of serum calcium levels, but who are unable to undergo parathyroidectomy.",,
Bosentan,Bosentan,1.0,RxNorm,23/06/2009,05/09/2017,Treatment of pulmonary arterial hypertension (WHO Group I) in patients with class III or IV symptoms to improve exercise ability and decrease clinical worsening,"Treatment of pulmonary arterial hypertension (PAH) (WHO Group 1) in pediatric patients aged 3 years and older with idiopathic or congenital PAH to improve pulmonary vascular resistance (PVR), which is expected to result in an improvement in exercise ability",,
Pirfenidone,Pirfenidone,1.0,RxNorm,14/09/2010,15/10/2014,Treatment of idiopathic pulmonary fibrosis,Treatment of idiopathic pulmonary fibrosis,,
Ganciclovir Sodium,Ganciclovir Sodium,1.0,RxNorm,05/04/2000,23/06/1989,Prevention and treatment of cytomegalovirus disease in immunocompromised and transplant patients,,,
Glatiramer Acetate,Glatiramer Acetate,1.0,RxNorm,03/06/2009,20/12/1996,Reduction of frequency of relapses in relapsing-remitting multiple sclerosis,For reduction of the frequency of relapses in patients with relapsing-remitting multiple sclerosis.,,
Meloxicam,Meloxicam,1.0,RxNorm,23/02/2015,11/08/2005,Non-steroidal anti-inflammatory,For relief of the signs and symptoms of pauciarticular or polyarticular course Juvenile Rheumatoid Arthritis in patients 2 years of age or older,,
Pilocarpine Hydrochloride,Pilocarpine Hcl,1.0,RxNorm,13/03/2003,11/02/1998,Treatment of radiation-induced xerostomia and Sjogren's syndrome,Treatment of dry mouth in patients with Sjogren's syndrome.,,
Melphalan,Melphalan,1.0,RxNorm,01/10/1964,18/11/1992,Anti-cancer drug,For the palliative treatment of patients with multiple myeloma for whom oral melphalan is not appropriate.,,
Mebendazole,Mebendazole,1.0,RxNorm,01/12/1974,19/10/2016,,treatment of patients one year of age and older withgastrointestinal infections caused by Ascaris lumbricoides (roundworm) and Trichuris trichiura (whipworm),,
Acyclovir,Acyclovir,1.0,RxNorm,11/09/2010,29/03/2019,Treatment of uncomplicated herpes zoster in immunocompetent patients,AVACLYR is a sterile topical antiviral indicated for the treatment of acute herpetic keratitis (dendritic ulcers) in patients with herpes simplex (HSV-1 and HSV-2) virus.,,
Pemetrexed Disodium,Pemetrexed Disodium,1.0,RxNorm,08/10/2008,04/02/2004,"In combination with cisplatin, first-line treatment of advanced/metastatic non-small cell lung cancer (non-squamous)",Treatment of patients with malignant pleural mesothelioma whose disease is either unresectable or who are otherwise not candidates for curative surgery,,
Edaravone,Edaravone,1.0,RxNorm,27/07/2007,05/05/2017,"Improvement of neurological symptoms, daily living disorder, and functional disorder in acute ischaemic stroke",Treatment of amyotrophic lateral sclerosis (ALS),,
Nitazoxanide,Nitazoxanide,1.0,RxNorm,17/03/2004,22/11/2002,,Treatment of diarrhea caused by Cryptosporidium parvum and Giardia lamblia,,
Nilotinib,Nilotinib,1.0,RxNorm,14/07/2010,22/03/2018,Treatment of chronic and accelerated phase Philadelphia chromosome positive CML in adults resistant to or intolerant of imatinib,TASIGNA (nilotinib) is indicated for the treatment of pediatric patients greater than or equal to 1 year of age with newly diagnosed Philadelphia chromosome positive chronic myeloid leukemia (Ph+ CML) in chronic phase and pediatric patients greater than or equal to 1 year of age with chronic phase Philadelphia chromosome positive chronic myeloid leukemia (Ph+ CML) with resistance or intolerance to prior tyrosine-kinase inhibitor (TKI) therapy.,,
Tadalafil,Tadalafil,1.0,RxNorm,27/02/2013,22/05/2009,Treatment of erectile dysfunction; erectile dysfunction with benign prostatic hyperplasia,Treatment of pulmonary arterial hypertension (WHO Group I) to improve exercise ability,,
Fenfluramine,Fenfluramine,1.0,RxNorm,09/07/1993,25/03/2022,—,Treatment of seizures associated with Lennox-Gastaut syndrome (LGS) in patients 2 years of age and older,,
Midodrine Hydrochloride,Midodrine Hcl,1.0,RxNorm,02/09/2016,06/09/1996,Treatment of symptomatic orthostatic hypotension,Treatment of symptomatic orthostatic hypotension.,,
Gabapentin,Gabapentin,1.0,RxNorm,15/12/2006,28/01/2011,Treatment of neuropathic pain; adjunctive therapy for partial seizures in adults,For the management of postherpetic neuralgia,,
Octreotide,Octreotide,1.0,RxNorm,01/08/2005,25/11/1998,—,Supression of severe diarrhea and flushing associated with malignant carcinoid syndrome.,,
Exemestane,Exemestane,1.0,RxNorm,29/08/2009,21/10/1999,"Adjuvant treatment of postmenopausal women with estrogen receptor-positive early breast cancer after 2–3 years of tamoxifen, switching to exemestane to complete 5 years of therapy",Treatment of advanced breast cancer in postmenopausal women whose disease has progressed following tamoxifen therapy.,,
Cyclosporin,Cyclosporine,1.0,RxNorm,10/03/2003,23/06/2021,Treatment of moderate to severe dry eye syndrome (keratoconjunctivitis sicca),Treatment of vernal keratoconjunctivitis (VKC) in children and adults,,
Diazepam,Diazepam (,1.0,RxNorm,17/06/1999,10/01/2020,Emergency treatment of convulsions; chronic prophylaxis against febrile seizures,"Acute treatment of intermittent, stereotypic episodes of frequent seizure activity (i.e., seizure clusters, acute repetitive seizures) that are distinct from a patients usual seizure pattern in patients with epilepsy 6 years of age and older.",,
Mifepristone,Mifepristone,1.0,RxNorm,13/02/2002,17/02/2012,Medical termination of intrauterine pregnancy through 49 days (by gynecologist only),for the control of hyperglycemia secondary to hypercortisolism in adult patients with endogenous Cushing's syndrome who have type 2 diabetes mellitus or glucose intolerance and have failed surgery or are not candidates for surgery.,,
Rifampicin,Rifampin,1.0,RxNorm,01/09/1971,25/05/1989,,,,
Selegiline Hydrochloride,Selegiline Hcl,1.0,RxNorm,01/08/1991,05/06/1989,Treatment of Parkinson's disease,,,
Ribavirin,Ribavirin,1.0,RxNorm,01/11/2006,29/07/2003,"Additional indication: 24-week regimen for hepatitis C (genotype 1), low viral load, HCV RNA negative at 4 weeks",Treatment of chronic hepatitis C among previously untreated pediatric patients at least three years of age or older.,,
Budesonide,Budesonide,1.0,RxNorm,05/08/2005,15/12/2021,Treatment of ulcerative colitis involving rectal and rectosigmoid diseases,"to reduce proteinuria in adults with primary immunoglobulin A nephropathy (IgAN) at risk of rapid disease progression, generally a urine protein-to-creatinine ratio (UPCR) > or = 1.5 g/g",,
Tolvaptan,Tolvaptan,1.0,RxNorm,06/09/2012,23/04/2018,"Treatment of hypervolemic and euvolemic hyponatremia, including patients with heart failure, cirrhosis, SIADH",JYNARQUE is indicated to slow kidney function decline in adults at risk of rapidly progressing autosomal dominant polycystic kidney disease (ADPKD),,
Mesna,Mesna,1.0,RxNorm,01/12/1981,30/12/1988,Urotoxic agent for prevention of urotoxic side effects with oxazaphosphorines in malignancy treatment,,,
Nimodipine,Nimodipine,1.0,RxNorm,31/08/1992,10/05/2013,Treatment and prevention of ischaemic neurological deficit due to arterial spasm after subarachnoid haemorrhage,"Improvement of neurological outcome by reducing the incidence and severity of ischemic deficits in adult patients with subarachnoid hemorrhage (SAH) from ruptured intracranial berry aneurysms regardless of their post-ictus neurological condition (i.e., Hunt and Hess Grades I-V).",,
Apomorphine Hcl,Apomorphine Hydrochloride,1.0,RxNorm,12/11/2007,03/02/2025,Treatment of erectile dysfunction in adult men,treatment of motor fluctuations in adults with advanced Parkinsons disease,,
Pilocarpine,Pilocarpine,1.0,RxNorm,24/06/1999,22/03/1994,Management of intraocular pressure in glaucoma,Treatment of symptoms of xerostomia from salivary gland hypofunction caused by radiotherapy for cancer of the head and neck.,,
Vemurafenib,Vemurafenib,1.0,RxNorm,19/10/2012,17/08/2011,Treatment of unresectable/metastatic melanoma with BRAFV600E mutation,Treatment of unresectable or metastatic melanoma with the BRAFV600E mutation as detected by an FDA-approved test.,,
Interferon Alfa-2B,Interferon Alfa-2A,0.9777777777777777,Fuzzy,27/12/2000,19/10/1995,"Treatment of cancers including multiple myeloma, Kaposi’s sarcoma, melanoma, leukemia, and other malignancies (specialist only)",Treatment of chronic myelogenous leukemia.,94.44444444444444,94.44444444444444
Lamotrigine Er,Lamotrigine,0.9571428571428571,Fuzzy,06/08/2012,24/08/1998,Add-on therapy for partial and secondary generalized tonic-clonic seizures,Adjunctive treatment of Lennox-Gastaut syndrome in pediatric and adult patients.,100.0,88.0
Apomorphine,Apomorphine Hcl,0.9466666666666667,Fuzzy,11/12/2007,20/04/2004,Treatment of erectile dysfunction in adult men,"For the acute, intermittent treatment of hypomobility, ""off"" episodes (""end-of-dose-wearing-off"" and unpredictable :on/off"" episodes) associated with advanced Parkinson's disease",100.0,84.61538461538461
Interferon Alpha-2B,Interferon Alfa-2A,0.9461988304093567,Fuzzy,01/05/1988,19/10/1995,"Anticancer; treatment of multiple myeloma, hairy cell leukemia, etc.",Treatment of chronic myelogenous leukemia.,86.48648648648648,86.48648648648648
Amiodarone,Amiodarone Hcl,0.9428571428571428,Fuzzy,01/04/1990,03/08/1995,Treatment of ventricular and supraventricular arrhythmia where other drugs cannot be used; arrhythmia with Wolff-Parkinson-White syndrome,For initiation of treatment and prophylaxis of frequently recurring ventricular fibrillation and hemodynamically unstable ventricular tachycardia in patients refractory to other therapy.,100.0,83.33333333333334
Mefloquine,Mefloquine Hcl,0.9428571428571428,Fuzzy,03/03/1997,03/05/1989,Treatment of severe and chloroquine-resistant malaria including cerebral malaria,Prophylaxis of Plasmodium falciparum malaria which is resistant to other available drugs,100.0,83.33333333333334
Clonidine Hcl,Clonidine,0.9384615384615385,Fuzzy,01/02/1975,02/10/1996,Treatment of hypertension,In combination with opiates for the treatment of severe pain in cancer patients that is not adequately relieved by opioid analgesics alone.,100.0,81.81818181818181
Fosphenytoin Sodium,Fosphenytoin,0.9263157894736842,Fuzzy,01/10/2002,05/08/1996,"Status epilepticus, seizure prevention/treatment during neurosurgery or head injury",For the control of generalized convulsive status epilepticus.,100.0,77.41935483870968
"Ifosfamide, Mesna",Ifosfamide,0.925,Fuzzy,30/07/1999,30/12/1988,,"In combination with certain other approved antineoplastic agents, for third line chemotherapy in the treatment of germ cell testicular cancer.",100.0,76.92307692307692
Metronidazole,Metronidazole (Topical),0.9238095238095239,Fuzzy,19/07/1993,22/11/1988,,,100.0,76.47058823529412
Fenfluramine Hydrochloride,Fenfluramine Hci,0.9230769230769231,Fuzzy,01/04/1972,25/06/2020,Anti-obesity drug,Fintepla (fenfluramine) is indicated for the treatment of seizures associated with Dravet syndrome in patients 2 years of age and older.,85.71428571428571,76.19047619047619
