Sr.No,Drug Name,Strength,Indication,Date of Approval
2853,Sodium picosulphate,5mg tablet oral; 10mg tablet oral; 5mg/5ml syrup oral,"Constipation, bowel clearance before labor/surgery or radiological exam",2/11/1997
2854,Tamoxifen citrate,10mg capsule oral,Treatment of hormone receptor-positive breast cancer,4/1/1981
2855,"Tinidazole, Diloxanide furoate",150mg tablet oral; 250mg tablet oral,Treatment of amoebiasis and protozoal infections,9/1/1984
2856,Tioconazole,65mg/g vaginal gel,Treatment of vulvovaginal candidiasis in adults,3/22/2011
2857,Tolfenamic acid,200mg capsule oral,Treatment of arthritis and pain-related inflammatory conditions,3/4/1998
2858,Trimethoxysilyl quaternary ammonium chloride,0.40% solution topical,Hand protectant and sanitizer; effective for 24 hours,6/11/2013
2859,"Aliskiren, Valsartan",150mg tablet oral; 160mg tablet oral; 300mg tablet oral; 320mg tablet oral,Treatment of hypertension,1/19/2010
2860,"Calcium succinate, Iron edetate sodium",,,10/1/1969
2861,Didanosine,125mg capsule oral; 200mg capsule oral; 250mg capsule oral; 400mg capsule oral,Treatment of HIV infection,7/24/2001
2862,Hydroxypropyl methylcellulose capsules,,NA,1/11/2011
2863,Eplerenone,25mg tablet oral; 50mg tablet oral,Treatment of mild to moderate hypertension in adults,6/9/2005
2864,Fondaparinux sodium,Injection subcutaneous,Treatment of acute coronary syndrome (ACS) with/without ST elevation,1/28/2008
2865,Fusafungine,,Old drug with new pump delivery system,3/26/1996
2866,"Haemocoagulase, Chlorhexidine gluconate",1 CU/g gel topical; 0.1% w/w topical,Treatment of localized capillary hemorrhage and wound healing,11/22/2004
2867,Medronate (Sn) MTC kit,10mg vial reconstituted; stannous chloride 1mg,"Diagnosis and imaging of bone lesions, Paget’s disease, fractures",2/23/1999
2868,Meloxicam,5mg/ml injection,Treatment of inflammatory conditions and fever in animals,4/2/2002
2869,Methylprednisolone aceponate,1mg/ml solution topical (0.1%),Treatment of eczema and allergic/inflammatory skin reactions,4/9/2007
2870,"Nebivolol, Amlodipine",5mg tablet oral; 10mg tablet oral,Treatment of hypertension,5/24/2006
2871,Paracetamol,500mg tablet oral fast release,As approved for pain and fever,2/10/2011
2872,Pimaricin,20mg/g ointment topical; 50mg vaginal tablet,Treatment of fungal infections,12/1/1961
2873,Pioglitazone,15mg tablet oral; 30mg tablet oral; 45mg tablet oral,Treatment of type 2 diabetes mellitus,10/17/2000
2874,Rosuvastatin calcium,,,6/25/1905
2875,Sorbisterit,0.5g capsule oral (calcium polystyrene sulfonate resin),,9/13/1993
2876,Spenglersan colloid G,,Immunomodulator,6/2/1997
2877,Surgical sealant kit,"Polyethylene glycol powder, dilute HCl, phosphate/sodium solution",Sealing suture lines in arterial/venous reconstructions,3/31/2009
2878,Azelastine,0.5mg/ml eye drops,Treatment of allergic conjunctivitis,5/5/2000
2879,Camostat mesylate,100mg tablet oral,Treatment of chronic pancreatitis and post-op reflux esophagitis,1/29/2008
2880,Citicoline,750mg tablet oral; 500mg/5ml syrup oral,As approved (not for children),4/10/2007
2881,"Biscodyl, Polyethylene glycol, Electrolytes",5mg tablet oral; 210g PEG + electrolytes sachet,Bowel prep before colonoscopy in adults,2/11/2011
2882,Famciclovir,125mg tablet oral; 250mg tablet oral; 500mg tablet oral; 750mg tablet oral,Treatment of herpes zoster in immunocompetent/immunocompromised,4/11/2002
2883,Filgrastim,30MU/ml injection; 48MU/1.6ml injection,Used in neutropenia and chemotherapy-induced leukopenia,9/30/1993
2884,Gemcitabine,,Combination with carboplatin for recurrent epithelial ovarian cancer,7/26/2004
2885,Goserelin acetate,3.6mg injection subcutaneous,"Treatment of prostate cancer, breast cancer, endometriosis",4/24/1996
2886,Hepatitis B vaccine (recombinant),10mcg/0.5ml injection; 20mcg/ml injection; 100mcg/100ml injection,Active immunization against hepatitis B,10/31/2000
2887,Indacaterol,150mcg capsule oral; 300mcg capsule oral,Treatment of COPD as a maintenance bronchodilator,2/28/2014
2888,Kanamycin sulphate,1g daily dose,"Treatment of resistant infections, including urinary tract and staphylococcus",12/1/1961
2889,"Levocetirizine, Ambroxol",5mg tablet oral; 75mg SR tablet oral,Treatment of productive cough,5/24/2006
2890,Lidocaine,700mg patch topical (5%),Relief of post-herpetic neuralgia pain (apply to intact skin only),3/31/2009
2891,"Losartan, Ramipril",50mg tablet oral; 2.5mg tablet oral; 5mg tablet oral,Treatment of mild to moderate hypertension,9/10/2003
2892,Mebrophen hydramine,25mg tablet oral,,12/1/1969
2893,"Piroxicam, Paracetamol",20mg tablet oral; 500mg tablet oral,"Treatment of fever and pain associated with URTI, musculoskeletal disorders, trauma, arthritis (short term)",1/19/2010
2894,Prazosin mesylate,,Treatment of mild to moderate hypertension,3/11/1999
2895,"Stavudine, Lamivudine, Nevirapine",30mg tablet oral; 40mg tablet oral; 150mg tablet oral; 200mg tablet oral,Treatment of HIV in patients stabilized on nevirapine therapy,7/26/2001
2896,Strontium ranelate,2g sachet oral,Treatment of postmenopausal osteoporosis,6/14/2005
2897,Apramycin sulphate,50g/100g powder veterinary,"Treatment of bacterial enteritis, colibacillosis, salmonellosis in poultry",7/22/1997
2898,Beriplast,,"Fibrin adhesive glue for tissue adhesion, haemostasis, wound care, body cavity sealing",6/19/1996
2899,Depo-Provera,Injection,Contraceptive (finished formulation),11/18/1993
2900,"Diclofenac sodium, Gentamicin sulfate",1mg/ml ophthalmic solution; 3mg/ml ophthalmic solution,Treatment of anterior segment eye inflammation with risk of bacterial infection,3/26/1999
2901,Emollient cream,2.5% sodium pyrrolidone carboxylic acid; 2.5% sodium lactate; 1% vitamin E; 3% olive oil,"Management of dry, scaly skin in atopy, hyperkeratosis, and eczema",4/15/2002
2902,Ertapenem,1g vial injection,"Treatment of moderate to severe bacterial infections including intra-abdominal, skin, pneumonia, UTI, pelvic infections",4/11/2007
2903,"Butaphosphan, Methyl hydroxybenzoate, Cyanocobalamin",100g powder oral; 1g powder oral; 50g powder oral,"Vitamin and phosphorus supplement for livestock, shrimp, and fish",3/20/2009
2904,Feracrylum,1% spray topical; 3% spray topical,"Management of post-operative wounds, cuts, and abrasions as haemostatic",7/24/2001
2905,Ferric carboxymaltose,50mg/ml injection intravenous,Treatment of iron deficiency when oral iron is ineffective or contraindicated,2/11/2011
2906,Fexofenadine hydrochloride,30mg tablet oral; 60mg tablet oral,"Treatment of allergic rhinitis (30mg: children 6–12yrs), chronic urticaria (60mg: ≥12yrs)",11/1/2000
2907,Hyaluronic acid,25mg/ml injectable; 25mg/ml cross-linked injectable,Intradermal implantation and facial soft tissue augmentation,1/30/2008
2908,Ibandronic acid,150mg tablet oral; 1mg/ml injection intravenous,Treatment of osteoporosis and metastatic bone disease due to breast cancer,5/29/2006
2909,"Lamivudine, Stavudine, Nevirapine","30mg, 60mg, 6mg, 12mg, 50mg, 100mg dispersible tablet oral",Treatment of pediatric HIV infection,6/14/2005
2910,Levofloxacin,750mg tablet oral,Treatment of complicated skin and skin structure infections,6/20/2003
2911,Orciprenaline sulfate,10mg tablet oral,,12/1/1969
2912,"Rabeprazole, Mosapride",20mg tablet oral; 15mg tablet oral,,7/27/2004
2913,"Soybean oil, Medium chain triglycerides, Olive oil, Fish oil, DL-alpha-tocopherol, Glycerol, Egg lecithin, Sodium hydroxide, Sodium pleate",60g/100ml; 50g/100ml; 30g/100ml; 163-225mg; 25g; 12g; 0.3mg emulsion infusion,Total parenteral nutrition after major surgeries,1/19/2010
2914,Amifostine,,Treatment to protect against xerostomia during radiation in head and neck cancer,11/6/2000
2915,Amifostine,300mg vial injection lyophilized powder,Additional strength formulation,7/23/2001
2916,"Atropine sulfate, Hyoscyamine sulfate, Scopolamine HCl, Phenobarbital",0.06mg tablet oral; 0.30mg tablet oral; 0.035mg tablet oral; 64.8mg tablet oral,,12/1/1969
2917,Deflazacort,18mg tablet oral,Same as approved,1/30/2010
2918,Diclofenac diethylamine,100mg transdermal patch,Treatment of mild to moderate pain due to osteoarthritis or soft tissue injury,8/1/2004
2919,"Formoterol fumarate, Budesonide",6mcg inhaler; 400mcg inhaler,Treatment of asthma requiring corticosteroid and long-acting beta-agonist,4/23/2002
2920,Ioversol,160mg/ml to 350mg/ml injection intravenous,Contrast medium for diagnostic imaging,12/29/1993
2921,Ketorolac tromethamine,20mg/g gel topical,"Treatment of muscle, joint, and post-traumatic pain",4/1/2009
2922,Letrozole,2.5mg tablet oral,Induction of ovulation in anovulatory infertility,4/10/2007
2923,Levofloxacin,750mg injection intravenous,,9/17/2003
2924,MMR Vaccine,,"Measles, mumps, and rubella immunization",3/26/1999
2925,"Nitazoxanide, Ofloxacin",500mg tablet oral; 200mg tablet oral,"Treatment of enterocolitis, urogenital, and other susceptible infections",7/1/2005
2926,Rocuronium bromide,50mg/5ml injection; 100mg/10ml injection,Adjunct to general anaesthesia for muscle relaxation,6/18/1996
2927,Saquinavir,Capsule oral,Treatment of advanced HIV infection,08/26/1997
2928,Ursodeoxycholic acid,125mg/5ml suspension oral; 250mg/5ml suspension oral,Treatment of chronic cholestatic liver disease,2/11/2011
2929,Baclofen,10mg capsule ER; 50mg capsule ER,Same as approved,2/17/2011
2930,Cefetamet pivoxil,250mg/5ml suspension oral,"Treatment of infections including otitis media, sinusitis, bronchitis, pneumonia, UTI, gonorrhea",8/1/2004
2931,Dalteparin sodium,,Injection subcutaneous,01/30/2008
2932,"Diphenoxylate, Atropine sulfate",2.5mg tablet oral; 0.025mg tablet oral,Antidiarrheal agent,6/1/1969
2933,"Frusemide, Potassium chloride",40mg CR tablet oral; 20mg CR tablet oral; 600mg CR tablet oral; 300mg CR tablet oral,Diuretic and potassium supplement,2/26/1993
2934,Ibopamine,2mg/ml eye drops,Myriatic agent for diagnostic ophthalmology,10/3/2003
2935,Ketoprofen,30mg transdermal patch,Treatment of musculoskeletal pain and inflammation,5/17/1999
2936,Midazolam maleate,,Bulk anesthetic agent,7/5/2005
2937,Perflutren injectable suspension,,Diagnostic use,5/31/2006
2938,Pregabalin,75mg SR tablet,Same as approved,1/30/2010
2939,Quetiapine,50mg SR tablet,Same as approved,4/10/2007
2940,Recombinant human erythropoietin,2000IU injection; 4000IU injection,"Treatment of anemia in cancer, chemotherapy, HIV, renal failure, and surgical autologous donation",11/8/2000
2941,Ritonavir,100mg capsule oral,Treatment of advanced HIV infection by specialist,8/9/1997
2942,Sevoflurane,,Inhalation for general anaesthesia,7/9/1996
2943,Sparfloxacin,0.3% w/v ophthalmic solution,Treatment of bacterial conjunctivitis and corneal infections,8/9/2001
2944,Sucrolase,,—,5/12/2009
2945,Tamsulosin,200mcg capsule MR; 400mcg capsule MR,Treatment of benign prostatic hyperplasia symptoms,4/4/2002
2946,"Beclomethasone dipropionate, Econazole, Neomycin",0.25mg/g cream; 10mg/g cream; 5mg/g cream,Topical treatment of bacterial and fungal infections,1/30/2008
2947,Calcium polycarbophil,500mg tablet oral,Relief of diarrhea and irritable bowel syndrome,7/13/2005
2948,"Cinnarizine, Dimenhydrinate",20mg tablet oral; 40mg tablet oral,Treatment of vertigo,2/3/2010
2949,Ciprofloxacin,500mg capsule ER; 1000mg capsule ER,"Treatment of RTI, sinusitis, UTI, skin infections, gynecological infections",8/16/2001
2950,Citicoline,500mg tablet oral; 250mg/ml injection; 500mg/ml injection,"Treatment of cerebral injuries of vascular or traumatic origin, chronic cerebral vascular injuries in dementia",8/23/2004
2951,Cyclosporin,0.1% eye drops,Ophthalmic use,6/2/2006
2952,Dexketoprofen trometamol,50mg tablet oral,Same as previously approved,2/21/2011
2953,Gliclazide,30mg modified-release tablet oral,Treatment of type 2 diabetes mellitus in adults alongside dietary management,11/9/2000
2954,Itraconazole,10mg/ml injection,Empiric therapy of febrile neutropenic patients with suspected fungal infections,4/29/2002
2955,"Metoprolol, Amlodipine",25mg tablet oral; 5mg tablet oral,Same as previously approved,4/10/2007
2956,Nimesulide,50mg suppository; 100mg suppository; 200mg suppository,Treatment of pain and inflammation,5/17/1999
2957,Perindopril arginine,2.5mg tablet oral; 5mg tablet oral; 10mg tablet oral,"Treatment of hypertension, heart failure, and coronary artery disease",5/19/2009
2958,Pneumococcal polysaccharide vaccine,,Prevention of pneumococcal pneumonia and systemic infections,7/9/1996
2959,Riluzole,,Treatment of amyotrophic lateral sclerosis (ALS),10/17/1997
2960,Valdecoxib,40mg tablet oral,Treatment of primary dysmenorrhea in adults,9/1/2003
2961,Nepafenac,,Bulk ingredient,6/8/2009
2962,Artemether,80mg ampoule injection; 40mg capsule oral,Treatment of severe and cerebral malaria; second-line in chloroquine-resistant cases,8/2/1996
2963,"Atorvastatin, Ezetimibe",10mg tablet oral; 20mg tablet oral; 10mg tablet oral,Treatment of hypercholesterolemia,8/13/2004
2964,"Interferon alpha-2b, Ribavirin",18MIU/1.2ml multidose pen injection; 200mg capsule oral (70 capsules),Combination therapy for chronic hepatitis C,8/28/2001
2965,Exenatide,5mcg/0.2ml injection; 10mcg/0.2ml injection,Adjunctive therapy for type 2 diabetes not controlled by other agents,1/30/2008
2966,"Papain, Urea",≥521700 units/g ointment topical; 100mg/g ointment topical,"Debridement of necrotic tissue and pus in ulcers, burns, wounds",7/15/2005
2967,"Gatifloxacin, Prednisolone acetate",0.3% eye drops; 1% eye drops,Ophthalmic use,6/2/2006
2968,Gatifloxacin,5mg/ml eye drops,Treatment of bacterial conjunctivitis,2/21/2011
2969,Levovist,4g/20ml granules; 2.5g/20ml granules,Contrast media for doppler sonography and echocardiography,11/28/1997
2970,Amphotericin-B,0.1% gel topical,Treatment of cutaneous and mucocutaneous fungal infections,2/5/2010
2971,Milrinone lactate,1mg/ml injection,Short-term treatment of severe congestive or acute heart failure,5/17/1999
2972,"Nadifloxacin, Clobetasol",10mg/g cream; 500mcg/g cream,Treatment of skin infections including contact/seborrheic dermatitis and infective eczema,10/6/2003
2973,Nateglinide,60mg tablet oral; 120mg tablet oral,Treatment of type 2 diabetes not adequately controlled by diet and exercise,5/1/2002
2974,Orlistat,60mg capsule oral,Weight loss and weight maintenance in obese patients with BMI ≥30 or ≥27 with risk factors,6/1/2009
2975,"Salmeterol, Fluticasone propionate","25mcg/actuation inhaler; 50mcg, 125mcg, 250mcg fluticasone inhaler",Regular treatment of asthma requiring bronchodilator and corticosteroid,11/9/2000
2976,Sunitinib malate,12.5mg capsule oral; 25mg capsule oral; 50mg capsule oral,Treatment of GIST after imatinib failure and advanced renal cell carcinoma,4/11/2007
2977,"Abacavir, Zidovudine, Lamivudine",300mg tablet oral; 300mg tablet oral; 150mg tablet oral,Treatment of HIV-1 infection,10/3/2003
2978,"Amlodipine, Metoprolol succinate",5mg tablet oral; 50mg tablet oral,Treatment of hypertension,6/5/2006
2979,Basiliximab,,Prophylaxis of acute organ rejection in transplantation with cyclosporin and corticosteroids,5/28/1999
2980,"Ciprofloxacin, Ornidazole",200mg/100ml injection; 500mg/100ml injection,Antibiotic combination therapy,4/20/2007
2981,"Coumaphos, Propoxur, Sulphanilamide",3% powder; 2% powder; 5% powder,Larvicidal wound dressing for livestock,4/23/2002
2982,"Diclofenac sodium, Paracetamol",50mg tablet oral; 500mg tablet oral,Treatment of acute pain and inflammation in arthritis,1/30/2008
2983,Fluticasone propionate,0.5mg/2ml nebuliser solution; 2.0mg/2ml nebuliser solution,Prophylactic treatment of severe bronchial asthma,11/9/2000
2984,"Formoterol fumarate, Budesonide",6mcg capsule inhaler; 100mcg capsule inhaler; 200mcg capsule inhaler,Treatment of asthma requiring corticosteroid and long-acting beta-agonist,8/17/2001
2985,Influenza vaccine inactivated,,Prophylaxis against influenza,8/13/1996
2986,Insulin lispro (rDNA),40 IU/ml injection (10ml vial),Treatment of diabetes mellitus,12/1/1997
2987,Moxifloxacin,0.5% ophthalmic solution,Treatment of bacterial conjunctivitis by ophthalmologists,8/27/2004
2988,Paclitaxel,30mg injection; 100mg injection; 300mg injection,Treatment of advanced squamous cell carcinoma of the head and neck,2/24/2011
2989,Sodium hyaluronate,14mg/ml gel injection; 18mg/ml gel injection; 25.5mg/ml gel injection,Same as approved,2/6/2010
2990,Testosterone,1% gel topical,Replacement therapy for male hypogonadism,7/12/2005
2991,Amino acid solution 5%,100ml injection containing various amino acids,Prophylaxis and treatment of protein depletion in children when oral feeding is not possible,4/23/2002
2992,Aprepitant,40mg capsule oral,Prevention of post-operative nausea and vomiting,4/24/2007
2993,Didanosine,25mg chewable tablet oral; 50mg chewable tablet oral; 100mg chewable tablet oral,Treatment of HIV infection with antiretroviral therapy,11/15/2000
2994,Erlotinib,25mg tablet oral; 100mg tablet oral; 150mg tablet oral,Treatment of metastatic non-small cell lung cancer after failure of prior chemotherapy,7/21/2005
2995,Gabapentin,600mg sustained release tablet oral,Adjunctive therapy for partial seizures in epilepsy,1/30/2008
2996,Glipizide,5mg tablet oral; 10mg tablet oral,Treatment of type 2 diabetes mellitus (NIDDM),8/21/1996
2997,Ketoprofen,Plaster 7cm x 10cm,Relief of musculoskeletal pain and inflammation,3/9/2011
2998,Leuprolide acetate,3.75mg vial injection intramuscular,Treatment of prostate cancer,12/10/1997
2999,Methadone,5mg/ml syrup oral; 10mg/ml syrup oral; 5mg tablet oral; 10mg tablet oral; 20mg tablet oral; 40mg tablet oral,Treatment and maintenance in opioid dependence,6/1/2009
3000,Miglitol,25mg tablet oral; 50mg tablet oral; 100mg tablet oral,Adjunct to diet for glycemic control in type 2 diabetes,8/1/2004
3001,Milnacipran,12.5mg tablet oral,As previously approved,2/6/2010
3002,"Nadifloxacin, Miconazole nitrate, Mometasone furoate",1% cream topical; 2% cream topical; 0.1% cream topical,Treatment of dermatoses,6/6/2006
3003,"Piperacillin, Tazobactam",4g/500mg vial injection intravenous; 2g/250mg vial injection intravenous,"Treatment of LRTI, UTI, intra-abdominal and skin infections, bacterial septicemia",8/13/1999
3004,Sumatriptan,5mg nasal spray; 20mg nasal spray,Treatment of acute migraine attacks with or without aura,8/29/2001
3005,Valdecoxib,10mg/g gel topical,Treatment of acute musculoskeletal disorders and post-traumatic inflammatory pain,10/8/2003
3006,Bemiparin sodium,"5000 IU injection; 7500 IU injection; 10,000 IU injection",Treatment and prevention of deep vein thrombosis,6/8/2006
3007,Ceftibuten,200mg capsule oral; 400mg capsule oral; 90mg/5ml suspension oral; 180mg/5ml suspension oral,"Treatment of URTI, LRTI, UTI, enteritis, and gastroenteritis",11/19/1996
3008,Chloroquine phosphate,0.3mg/ml eye drops,Treatment of dry eye syndrome,7/13/2005
3009,Fexofenadine,60mg/5ml suspension oral,Treatment of allergic conditions in pediatric and geriatric patients,8/27/2001
3010,Fluconazole,0.5% gel topical (5mg/g),Treatment of tinea cruris and tinea corporis fungal infections,8/13/2004
3011,"Memantine, Donepezil",5mg tablet oral; 10mg tablet oral; 5mg tablet oral,Treatment of moderate to severe Alzheimer's disease,1/31/2008
3012,"Meropenem, Sulbactam",1000mg injection; 500mg injection,Treatment of lower respiratory tract infections caused by gram-negative bacteria in adults,3/15/2011
3013,Olopatadine,0.2% ophthalmic solution,As previously approved,4/24/2007
3014,Pravastatin,10mg tablet oral; 20mg tablet oral; 40mg tablet oral,"Treatment of primary hypercholesterolemia types IIa, IIb and prevention of cardiovascular events",12/20/2000
3015,Follicle stimulating hormone,37.5 IU injection,As previously approved (additional strength),8/19/1999
3016,"Rofecoxib, Paracetamol",25mg tablet oral; 500mg tablet oral,Treatment of acute pain in adults,10/1/2003
3017,Ropinirole,6mg extended release tablet oral,As previously approved,2/6/2010
3018,"Sucralfate, Metronidazole",0.07g/g cream topical; 0.01g/g cream topical,"Treatment of bedsores, hemorrhoids, fistulae, and fissures",4/29/2002
3019,Topiramate,Tablet oral; sprinkle capsule oral,As previously approved (additional indication),10/1/2004
3020,Zoledronic acid,5mg/100ml injection intravenous,Treatment of osteoporosis in postmenopausal women and men at high fracture risk,1/7/2009
3021,2-Bromo-2-nitropropan-3-diol,,,4/1/1975
3022,Aspirin DL lysine,900mg vial injection,Treatment as per aspirin clinical use,4/1/1986
3023,Bacillus clausii,2 billion/5ml oral suspension,Treatment of altered intestinal bacterial flora,1/28/2005
3024,"Beclomethasone dipropionate, Neomycin sulphate, Chinoform",0.025% topical; 0.025% + 0.5% topical; 0.025% + 3% topical,Treatment of inflammatory skin conditions,4/1/1974
3025,Bitoscanate,,Anthelmintic,4/1/1970
3026,Budesonide,200mcg inhaler inhalation,Treatment of bronchial asthma,2/1/1988
3027,Carboprost tromethamine,250mcg/ml injection intramuscular,Abortifacient for second trimester abortion,3/1/1979
3028,Carnecaine,2% injection (20mg/ml),Treatment as per articaine (local anesthetic),2/1/1987
3029,Carvedilol,3.125mg tablet oral; 6.25mg tablet oral,Treatment of congestive heart failure,3/10/1999
3030,Centella asiatica,200mg tablet oral; 2% vial topical; 1% ointment topical; 2% powder topical,Promotes wound healing and improves microcirculation,5/1/1976
3031,"Chlorphenoxamine, Caffeine",12mg tablet oral; 30mg tablet oral,Treatment of allergies and drowsiness,7/1/1972
3032,Cilostazol,50mg tablet oral; 100mg tablet oral,Treatment of intermittent claudication,1/23/2003
3033,Cisplatin,10mg vial injection; 50mg vial injection,Treatment of metastatic testicular and ovarian tumors,4/1/1982
3034,Citicoline,750mg/5ml oral syrup,Treatment of impaired consciousness due to head trauma or stroke,1/4/2008
3035,"Cloxacillin sodium, Colistin sulphate",200mg intramammary infusion; 50000 units intramammary infusion,Treatment of mastitis (veterinary use),3/4/1998
3036,"Oxethazaine, Aluminium hydroxide, Magnesium hydroxide",,"Antacid, demulcent, mucosal anesthetic",6/1/1966
3037,Dehydro-emetine,,Treatment of amoebiasis (synthetic anti-emetine),4/1/1963
3038,"Diethylamine salicylate, Nopoxamine",10g topical; 1g topical,Treatment of musculoskeletal pain and inflammation,3/1/1980
3039,Dimethyl fumarate,120mg capsule oral; 240mg capsule oral,Treatment of relapsing-remitting multiple sclerosis,8/27/2014
3040,Diphenylpyraline hydrochloride,5mg capsule oral,Treatment of allergic conditions including rhinitis and eczema,4/1/1969
3041,Doripenem,250mg vial injection; 500mg vial injection,Treatment of nosocomial pneumonia in adults,2/16/2009
3042,Dronedarone,400mg tablet oral,To reduce risk of cardiovascular hospitalization in atrial fibrillation/flutter patients with risk factors,4/9/2010
3043,Empagliflozin,10mg tablet oral; 25mg tablet oral,Adjunct to diet and exercise for type 2 diabetes mellitus,5/7/2015
3044,"Flucortolone, Flucortolone caproate",,"For acute and chronic eczema, allergic dermatosis",7/1/1968
3045,Fluvastatin,10mg tablet oral; 20mg tablet oral; 40mg tablet oral,Treatment of hyperlipidemia (as per prior approval),1/29/2007
3046,Fosinopril sodium,10mg tablet oral; 20mg tablet oral; 40mg tablet oral,Treatment of mild to moderate hypertension,1/10/2002
3047,"Hydroxyethyl theophylline, Theophylline monohydrate",231mg sustained-release tablet oral; 69mg sustained-release tablet oral,Treatment of asthma and other respiratory diseases,6/1/1981
3048,"Ibuprofen, Paracetamol",400mg tablet oral; 325mg tablet oral,Treatment of pain and inflammation,10/1/1984
3049,Ilaprazole,5mg tablet oral; 10mg tablet oral,Treatment of duodenal ulcer in adults,4/5/2011
3050,Erdosteine,35mg/ml oral suspension,Treatment of chronic obstructive bronchitis,2/6/2006
3051,"Irbesartan, Hydrochlorothiazide",150mg tablet oral; 300mg tablet oral; 12.5mg tablet oral,Treatment of mild to moderate hypertension,1/31/2001
3052,Iron (III) isomaltoside 1000,100mg/ml injection or infusion,Treatment of iron deficiency anemia when oral iron is not effective or suitable,8/20/2013
3053,"Levocetirizine, Pseudoephedrine",2.5mg tablet oral; 5mg tablet oral; 120mg sustained-release tablet oral,Treatment of seasonal allergic rhinitis,1/29/2004
3054,"Lynestrenol, Mestranol",2.5mg tablet oral; 0.075mg tablet oral,Oral contraceptive,4/1/1967
3055,Mefloquine,250mg tablet oral,Treatment of severe and chloroquine-resistant malaria including cerebral malaria,3/3/1997
3056,Methotrimeprazine,5mg tablet oral; 25mg tablet oral; 100mg tablet oral; 25mg/ml injection intramuscular,,1/1/1964
3057,Metoclopramide,15mg tablet oral,"Restore coordination and tone in upper digestive tract; treatment of reflux esophagitis, gastritis, duodenitis, hiatus hernia, dyspepsia, nausea, and vomiting",4/13/1992
3058,Nefopam,30mg tablet oral; 20mg/ml injection intramuscular,"Treatment of acute and chronic pain including postoperative, dental, musculoskeletal, traumatic, and cancer pain",4/1/1991
3059,Nintedanib,100mg capsule oral; 150mg capsule oral,With docetaxel for treatment of advanced or metastatic non-small cell lung cancer (adenocarcinoma histology) after chemotherapy,4/1/2016
3060,Norethisterone,0.35mg tablet oral,Used in hormonal contraception and menstrual disorders,5/1/1977
3061,N-Phenylethyl anthranilic acid,300mg tablet oral,,4/1/1978
3062,Olanzapine,2.5mg tablet oral; 5mg tablet oral; 7.5mg tablet oral; 10mg tablet oral,Treatment of schizophrenia in adults,1/27/2000
3063,Piroxicam betacyclodextrin,20mg tablet oral,"Treatment of pain and inflammation in rheumatoid arthritis, osteoarthritis, musculoskeletal pain, tendinitis, bursitis, post-traumatic disorders, dysmenorrhea",3/25/1996
3064,Polythiazide,2mg tablet oral; 4mg tablet oral,Treatment of hypertension and edema,2/1/1962
